{
  "id": "ccc-2026-06-28-proper-13",
  "meta": {
    "title": "Choral Eucharist — Proper 13",
    "rite": "Choral Eucharist (BAS tradition, Eucharistic Prayer 1 / BAS p. 193)",
    "tradition": "Anglican Church of Canada, Diocese of New Westminster",
    "date": "2026-06-28",
    "calendar": {
      "season": "Season after Pentecost",
      "proper_local": "Proper 13",
      "proper_rcl": "Proper 8 (US/Episcopal RCL numbering; same Sunday, same readings)",
      "lectionary_year": "Year A (Matthew)",
      "track": "Track 1 (semicontinuous)"
    },
    "ministers": {
      "presider": "The Very Rev. Christopher A. Pappas (Dean & Rector)",
      "preacher": "The Rev. Claude St-Denis",
      "deacon": "The Rev. Kevin de la Mare",
      "organist": "Dr. Neil Cockburn (Organist & Director of Music)",
      "subdeacon": "Esther Aneke",
      "mc": "Carol Cook"
    },
    "music_settings": [
      "Gloria — New Plainsong, David Hurd",
      "Sanctus — Mass in G minor, Ralph Vaughan Williams",
      "Lord's Prayer — McNeil Robinson",
      "Agnus Dei (Fraction Anthem) — Mass in G minor, Ralph Vaughan Williams"
    ],
    "source_missal": {
      "folder": "data_lake/missal-2026-06-28-proper-13",
      "pages": 12,
      "official_pdf": "official-missal-proper-13.pdf"
    },
    "authorities": [
      "Great Thanksgiving: BAS Eucharistic Prayer 1, BAS p. 193 (Sursum corda BAS p.192).",
      "Sacring bell 'Ringing of the bell. (x3)' is PRINTED in this missal (page-08) — the primary attestation that this parish rings the bell.",
      "BAS (Anglican Church of Canada), Holy Eucharist pp. 174–215 — see context/bas-eow-eucharist-rubrics.md",
      "Postures per BAS: 'All stand' at the Gathering (p.185), Gospel (p.187), Peace (p.191), and after Communion (p.213); sitting for readings/sermon and kneeling for confession/canon are custom (b), not rubric; communion posture is permissive 'either kneeling or standing' (p.180).",
      "Dismissal by the deacon — BAS p.214 (a).",
      "Parish-specific ceremonial (Broad Church; sacring bell yes, incense no) — context/christ-church-cathedral-practice.md."
    ]
  },
  "roles": [
    {
      "id": "presider",
      "label": "Presider (The Very Rev. Christopher A. Pappas)",
      "kind": "clergy"
    },
    {
      "id": "preacher",
      "label": "Preacher (The Rev. Claude St-Denis)",
      "kind": "clergy"
    },
    {
      "id": "deacon",
      "label": "Deacon (The Rev. Kevin de la Mare)",
      "kind": "clergy"
    },
    {
      "id": "reader",
      "label": "Reader / Lector",
      "kind": "lay-minister"
    },
    {
      "id": "intercessor",
      "label": "Intercessor (Byron Jang)",
      "kind": "lay-minister"
    },
    {
      "id": "servers",
      "label": "Servers / Subdeacon / MC",
      "kind": "lay-minister"
    },
    {
      "id": "lay_ministers",
      "label": "Lay Administrants of Communion",
      "kind": "lay-minister"
    },
    {
      "id": "choir",
      "label": "The Cathedral Choir",
      "kind": "musician"
    },
    {
      "id": "organist",
      "label": "Organist & Director of Music (Dr. Neil Cockburn)",
      "kind": "musician"
    },
    {
      "id": "assembly",
      "label": "The assembly / congregation",
      "kind": "assembly"
    }
  ],
  "stations": [
    {
      "id": "nave",
      "label": "Nave (where the assembly sits)"
    },
    {
      "id": "chancel",
      "label": "Chancel / choir"
    },
    {
      "id": "altar",
      "label": "Altar / Holy Table"
    },
    {
      "id": "ambo",
      "label": "Ambo / lectern (readings & preaching)"
    },
    {
      "id": "gospel_station",
      "label": "Gospel Station (Gospel read amid the assembly)"
    },
    {
      "id": "presider_chair",
      "label": "Presider's chair"
    },
    {
      "id": "west_alcove",
      "label": "West alcove (healing prayer during communion)"
    },
    {
      "id": "door",
      "label": "West door / entrance (procession start & end)"
    }
  ],
  "events": [
    {
      "seq": 1,
      "section": "gathering",
      "unit": "Announcements",
      "action": "say",
      "mode": "spoken",
      "actor": [
        "presider"
      ],
      "assembly_posture": "sit",
      "station": "ambo",
      "content": {
        "type": "text",
        "text": "Cathedral parish announcements commence shortly before 10:30 a.m."
      },
      "provenance": "printed",
      "missal_source": "page-03",
      "notes": "Printed this week (Proper 14 did not print an announcements line — a compression difference)."
    },
    {
      "seq": 2,
      "section": "gathering",
      "unit": "Prelude / Gathering music",
      "action": "music",
      "mode": "instrumental",
      "actor": [
        "organist"
      ],
      "assembly_posture": "sit",
      "station": "chancel",
      "content": {
        "type": "none"
      },
      "provenance": "inferred",
      "convention": "Universal custom: organ covers the gathering before the entrance. [organ covering the gathering = universal custom]",
      "missal_source": null
    },
    {
      "seq": 3,
      "section": "gathering",
      "unit": "Entrance Procession",
      "action": "process",
      "mode": "physical",
      "actor": [
        "servers",
        "deacon",
        "preacher",
        "presider"
      ],
      "assembly_posture": "stand",
      "station": "door",
      "content": {
        "type": "none"
      },
      "provenance": "inferred",
      "convention": "BAS: ministers enter in procession during the opening hymn; assembly stands. [BAS p.185 'All stand'; entrance procession is general Anglican custom (b) — context/bas-eow-eucharist-rubrics.md]",
      "missal_source": null
    },
    {
      "seq": 4,
      "section": "gathering",
      "unit": "Processional Hymn",
      "action": "sing",
      "mode": "sung",
      "actor": [
        "assembly",
        "choir",
        "organist"
      ],
      "assembly_posture": "stand",
      "station": "nave",
      "content": {
        "type": "pointer",
        "pointer": {
          "kind": "hymn",
          "ref": "CP 434",
          "source": "Common Praise",
          "title": "The Love of Jesus Calls Us (Aurelia)"
        }
      },
      "provenance": "pointer",
      "missal_source": "page-03",
      "notes": "Full text printed in this missal (P14 printed only title+number for its processional — a compression difference)."
    },
    {
      "seq": 5,
      "section": "gathering",
      "unit": "Gathering Dialogue / Land Acknowledgement",
      "action": "greet",
      "mode": "spoken",
      "actor": [
        "presider",
        "assembly"
      ],
      "assembly_posture": "stand",
      "station": "presider_chair",
      "content": {
        "type": "dialogue",
        "dialogue": [
          {
            "by": "presider",
            "says": "In this time and place, we gather on the unceded ancestral lands of the Musqueam, Squamish, and Tsleil-Waututh nations."
          },
          {
            "by": "assembly",
            "says": "From many places and peoples we come to this house of prayer."
          },
          {
            "by": "presider",
            "says": "In this time and place, we meet in the presence of the living God."
          },
          {
            "by": "assembly",
            "says": "The Creator who is the source of all that is, seen and unseen."
          },
          {
            "by": "presider",
            "says": "In this time and place, the risen Christ stands in our midst."
          },
          {
            "by": "assembly",
            "says": "Our Companion who walks with us and with all peoples on the path of reconciliation."
          },
          {
            "by": "presider",
            "says": "In this time and place, God's Holy Spirit breathes in and through us."
          },
          {
            "by": "assembly",
            "says": "We are being made new by the holy and life-giving Trinity, one God."
          }
        ]
      },
      "provenance": "printed",
      "missal_source": "page-03",
      "notes": "A full trinitarian gathering litany — much longer than Proper 14's one-line acknowledgement. The gathering rite is itself a 'proper' that varies week to week."
    },
    {
      "seq": 6,
      "section": "gathering",
      "unit": "Gloria",
      "action": "sing",
      "mode": "sung",
      "actor": [
        "assembly",
        "choir",
        "organist"
      ],
      "assembly_posture": "stand",
      "station": "nave",
      "content": {
        "type": "pointer",
        "pointer": {
          "kind": "setting",
          "ref": "CP 686",
          "source": "Common Praise",
          "title": "Glory to God — New Plainsong, David Hurd"
        }
      },
      "provenance": "pointer",
      "missal_source": "page-04",
      "notes": "Same Gloria setting as Proper 14 — a fixed ordinary element."
    },
    {
      "seq": 7,
      "section": "gathering",
      "unit": "The Collect of the Day",
      "action": "pray",
      "mode": "spoken",
      "actor": [
        "presider",
        "assembly"
      ],
      "assembly_posture": "stand",
      "station": "presider_chair",
      "content": {
        "type": "text",
        "text": "Almighty God, you have taught us through your Son that love fulfils the law. May we love you with all our heart… and may we love our neighbour as ourselves; through Jesus Christ our Lord…"
      },
      "provenance": "printed",
      "missal_source": "page-04",
      "notes": "'Let us pray' + kept silence precede it (printed)."
    },
    {
      "seq": 8,
      "section": "word",
      "unit": "First Reading",
      "action": "proclaim",
      "mode": "spoken",
      "actor": [
        "reader"
      ],
      "assembly_posture": "sit",
      "station": "ambo",
      "content": {
        "type": "pointer",
        "pointer": {
          "kind": "lection",
          "ref": "Genesis 22:1-14",
          "source": "RCL Track 1",